1873,GROUND WATER U/S OF MSW DUMPING SITE ATDHARAMSHALA KANGRA,HIMACHAL PRADESH,12,12,6.85,6.91,317,323,BDL,BDL,0.47,0.47,2,2,17,17,220,224,BDL,BDL,?,?
1874,"SPRING SOURCE (GROUND WATER) BELOW SWM SITE AT SALOGRA, VILL. SALOGRA, DISTT.SOLAN",HIMACHAL PRADESH,12,19,7.94,8.12,211,612,BDL,BDL,3,7.41,2,22,25,79,108,337,0.33,0.42,?,?
1876,BOREWELL AT HPMCPARWANOO,HIMACHAL PRADESH,?,?,7.75,8.35,424,522,BDL,BDL,5.54,14.31,2,2,27,27,212,274,0.47,0.47,?,?
1877,GROUND WATER  NEAR USV LIMITED HPSIDC BADDI AT BADDIINDUSTRIAL AREA,HIMACHAL PRADESH,?,?,7.97,8.42,521,683,BDL,BDL,1.94,2.62,2,2,21,21,287,451,0.26,1.3,?,?
1878,GROUND WATER (NEAR ELECTRICITY OFFICE BAROTIWALA) BAROTIWALAINDUSTRIAL AREA,HIMACHAL PRADESH,?,?,7.59,7.94,525,1690,3,3,6.72,12.93,8,8,70,70,295,896,0.35,0.35,?,?
1879,GROUND WATER (NEAR ACME FORMULATION NALAGARH)NALAGARH INDUSTRIAL AREA,HIMACHAL PRADESH,?,?,7.37,8,747,961,BDL,BDL,5.41,14.3,2,2,21,21,481,554.2,0.33,0.62,?,?
1880,TUBEWELL  OPPOSITE IIIT COLLEGE OF ENGINEERING NEAR INDUSTRIAL AREA JOHRON KALAAMB,HIMACHAL PRADESH,?,?,7.36,7.54,941,1081,BDL,BDL,0.32,3.9,BDL,BDL,BDL,BDL,332,490,0.24,0.44,?,?
1881,"BOREWELL NEAR JSV TANK, SWCA OFFICE  AT GONDPUR, INDUSTRIAL AREA, PAONTASAHIB",HIMACHAL PRADESH,22,25,7.73,7.87,452,789,1.1,1.1,0.32,11.86,BDL,BDL,4.5,4.5,289,308,0.46,0.93,?,?
1882,BOREWELL NEAR OVERHEAD TANK OF IADA MEHATPURINDUSTRIAL AREA,HIMACHAL PRADESH,25,25,6.7,6.7,747,747,BDL,BDL,0.32,0.32,2,2,31,31,505,505,BDL,BDL,?,?
2628,HAND PUMP NEAR THE BUSSTOP AT WORKSHOP CHOWK,HIMACHAL PRADESH,12,20,7.7,8,390,500,BDL,BDL,0.32,0.32,BDL,BDL,BDL,BDL,267,345,0.29,0.29,?,?
2629,HAND PUMP AT MANDI TOWN(NEAR CANARA BANK),HIMACHAL PRADESH,21,22,8.1,8.33,198,540,BDL,BDL,0.41,0.98,BDL,BDL,BDL,BDL,134,367,0.31,0.31,?,?
2630,HANDPUMP NEAR EXIT GATE OFBUS STAND HAMIRPUR,HIMACHAL PRADESH,23,25.8,7.58,7.64,559,639,BDL,BDL,0.32,2.1,2,2,17,22,396,407,BDL,BDL,?,?
2631,HAND PUMP INSIDE THE BUSSTAND AT NADAUN TOWN,HIMACHAL PRADESH,25.5,26,6.9,7.67,314,668,BDL,BDL,0.32,3.46,2,2,3.6,24,213,428,BDL,BDL,?,?
2632,HAND PUMP AT BILASPUR TOWN(NEAR LAXMINARAYAN TEMPLE),HIMACHAL PRADESH,19,23,7.42,7.54,628,795,BDL,BDL,0.33,4.04,BDL,BDL,BDL,BDL,433,540,0.24,0.32,?,?
2633,HAND PUMP AT RECONGPEO,HIMACHAL PRADESH,?,?,7.99,8.01,450,505,BDL,BDL,0.32,12.62,BDL,BDL,BDL,BDL,295,303,0.25,0.25,BDL,BDL
2634,HAND PUMP NEAR VIJAYNAGARTOTU SHIMLA,HIMACHAL PRADESH,10,10,7.96,7.96,287,287,BDL,BDL,4.97,4.97,?,?,?,?,183,183,BDL,BDL,BDL,BDL
2635,HAND PUMP NEAR NOGLI ATRAMPUR,HIMACHAL PRADESH,?,?,7.78,8.13,355,429,BDL,BDL,0.32,39.77,9.2,9.2,21,21,212,302,0.25,0.25,BDL,BDL
2636,HAND PUMP NEAR KANGRATEMPLE,HIMACHAL PRADESH,?,?,6.89,6.89,494,494,BDL,BDL,2.68,2.68,2,2,17,17,345,345,BDL,BDL,?,?
2637,HAND PUMP AT JWALAJI TEMPLE,HIMACHAL PRADESH,?,?,6.74,7.12,156,1364,BDL,BDL,0.32,1.28,2,2,13,22,126,811,BDL,BDL,?,?
2638,BOREWELL NEAR CHINTPURNITEMPLE AT UNA TOWN,HIMACHAL PRADESH,23,26.5,7.5,7.52,401,455,BDL,BDL,0.32,3.26,2,2,13,25,272,313,BDL,BDL,?,?
2639,HAND PUMP NEAR CHAMUNDADEVI TEMPLE,HIMACHAL PRADESH,18,18,6.8,7.89,119,142,BDL,BDL,0.32,1.68,2,2,21,24,79,101,BDL,BDL,?,?
2640,HAND PUMP NEAR SANSARPURTERRACE INDUSTRIAL AREA,HIMACHAL PRADESH,23,23,6.78,6.91,289,551,BDL,BDL,0.32,5.15,2,2,21,38,188,385,BDL,BDL,?,?
2641,HAND PUMP NEAR TEXI STANDCHAMBA TOWN,HIMACHAL PRADESH,15,15,7.85,7.85,320,320,BDL,BDL,1.91,1.91,2,2,17,17,218,218,BDL,BDL,?,?
2642,HAND PUMP NEAR HOTEL PINEWOOD AT DALHOUSIE ROAD,HIMACHAL PRADESH,14,14,7.09,7.09,592,592,BDL,BDL,2.28,2.28,2,2,13,13,408,408,BDL,BDL,?,?
2645,HAND PUMP AT NAHAN NEARPOLICE POST GUNNUGHAT,HIMACHAL PRADESH,?,?,7.85,7.91,541,758,1.1,1.1,0.32,2.88,BDL,BDL,BDL,BDL,241,336,0.43,1.21,?,?
2646,HAND PUMP NEAR MOGINANADAT KALA AMB,HIMACHAL PRADESH,?,?,7.2,7.31,893,1006,BDL,BDL,0.32,3.92,BDL,BDL,BDL,BDL,372,480,0.45,0.74,?,?
2647,HAND PUMP AT TAHLIWALBAZAR,HIMACHAL PRADESH,31,31,7.55,7.55,617,617,BDL,BDL,0.32,0.32,2,2,33,33,392,392,BDL,BDL,?,?
2648,HAND PUMP AT KEYLONG,HIMACHAL PRADESH,6,13,7.21,8.24,315,388,BDL,BDL,0.32,2.87,BDL,BDL,BDL,BDL,214,265,0.49,0.54,?,?
4434,BOREWELL NEAR UNA?HAROLI BRIDGE  INDUSTRIAL AREAJEETPUR BEHRI,HIMACHAL PRADESH,21,27,7.18,7.24,396,436,BDL,BDL,0.32,4.2,2,2,17,27,182,265,BDL,BDL,?,?
4456,HANDPUMP NEAR SATSANGBHAWAN  VILLAGE MUGLA,HIMACHAL PRADESH,15,17,6.62,7.7,124,437,BDL,BDL,0.63,1.47,2,2,21,21,81,302,BDL,BDL,?,?
4465,GROUND WATER INTAKE POINTOF BBMB AT VILL. HARABAGH,HIMACHAL PRADESH,13,23,7.09,7.88,380,710,BDL,BDL,0.39,2.38,23,63,150,280,259,486,0.24,0.76,?,?
4467,"GROUND WATER NEAR LIFT WATER SUPPLY SCHEME AT DARI DHARAMSHALA AT HOTEL DHAULADHAR HEIGHTS DARI,DHARAMSHALA",HIMACHAL PRADESH,?,?,6.85,7.57,153,163,BDL,BDL,0.32,2.68,2,2,21,27,105,116,BDL,BDL,?,?
4468,"GROUND WATER SUPPLY SCHEME NEAR MELA GROUNDDARI, DHARAMSHALA",HIMACHAL PRADESH,?,?,6.83,7.53,151,159,BDL,BDL,0.32,1.14,2,2,17,31,101,105,BDL,BDL,?,?
4472,GROUND WATER NEAR SUPPLY SCHEME AT NAGROTABHAGWAN,HIMACHAL PRADESH,?,?,-6.61,6.95,194,203,BDL,BDL,0.32,0.32,2,2,13,13,125,140,BDL,BDL,?,?
4478,"LIFTING WATER SUPPLY SCHEME SHAMSHI, NEAR SABJI MANDIBHUNTER, TEHSIL KULLU",HIMACHAL PRADESH,12,12,7.9,7.9,202,202,BDL,BDL,0.32,0.32,41,41,220,220,137,137,BDL,BDL,?,?
4483,GROUND WATER SUPPLYSCHEME (MC UNA),HIMACHAL PRADESH,26,28,7.22,7.5,464,478,BDL,BDL,0.32,2.6,2,2,21,33,241,325,BDL,BDL,?,?
4484,"DRINKING WATER SUPPLYSCHEME NO. 7, SANOLI",HIMACHAL PRADESH,20,25.5,6.92,7.8,165,899,BDL,BDL,0.61,3.12,2,2,17,21,113,485,BDL,BDL,?,?
5249,GROUND WATER NEAR PULGHRAT BRIDGE ALONGNATIONAL HIGHWAY,HIMACHAL PRADESH,18,22,8.03,8.4,205,274,BDL,BDL,0.67,0.99,BDL,BDL,BDL,BDL,137,183,0.24,0.24,?,?
5250,"BOREWELL IN THE PREMISES OF M/S BHAGWATI AUTOMOBILE, PLOT NO. 13, INDL AREA SAULIKHAD, DIST. MANDI",HIMACHAL PRADESH,19,21,6.57,7.2,190,262,BDL,BDL,1.27,4.64,BDL,BDL,BDL,BDL,127,174,0.22,0.95,?,?
5258,"GROUUND WATER AT VPO SANOLI, SUB?TEHSIL MEHTAPUR (DRINKING WATER SUPPLYSCHEME)",HIMACHAL PRADESH,18,29.5,6.64,8.01,832,1232,BDL,BDL,0.32,5.21,2,4,12,49,259,898,BDL,BDL,?,?
2759,DUGWELL AT GAGHWAL(KATHUADISTT),JAMMU AND KASHMIR,18,18,7.1,7.1,468,468,?,?,?,?,?,?,?,?,274,274,?,?,?,?
2760,MALADHAR TALAB(POND)HATLI(KATHUA),JAMMU AND KASHMIR,21,21,7.96,7.96,186,186,1.6,1.6,?,?,?,?,?,?,110,110,?,?,?,?
2761,TUBE WELL KATHUA SICOPINDUSTRIAL AREA KATHUA,JAMMU AND KASHMIR,18,18,6.86,6.86,430,430,?,?,?,?,?,?,?,?,256,256,?,?,?,?
2762,"R.S. PURA TEHSIL, JAMMU AND KASHMIR",JAMMU AND KASHMIR,23,23,7.88,7.88,1055,1055,2.3,2.3,?,?,?,?,?,?,596,596,?,?,?,?
4064,BOREWELL NEAR INDUSTRIALAREA GANGYAL,JAMMU AND KASHMIR,23,23,7.32,7.32,312,312,?,?,?,?,?,?,?,?,188,188,?,?,?,?
4065,BOREWELL NEAR INDUSTRIALAREA BARI?BRAHMNA,JAMMU AND KASHMIR,23,23,7.52,7.52,324,324,?,?,?,?,?,?,?,?,190,190,?,?,?,?
4066,BOREWELL NEAR INDUSTRIALAREA SAMBA,JAMMU AND KASHMIR,18,18,7.2,7.2,560,560,?,?,?,?,?,?,?,?,326,326,?,?,?,?
4067,BOREWELL NEAR INDUSTRIALAREA UDHAMPUR,JAMMU AND KASHMIR,18,18,8.15,8.15,430,430,?,?,?,?,?,?,?,?,254,254,?,?,?,?
4068,BABA TALAB (ANCIENT POND) ATMISHRIWALA (WETLAND),JAMMU AND KASHMIR,21,21,7.65,7.65,320,320,BDL,BDL,?,?,?,?,?,?,188,188,?,?,?,?
4069,ANCIENT BOWLIES INUDHAMPUR AT GANGERA BOWLI,JAMMU AND KASHMIR,15,15,8,8,520,520,BDL,BDL,?,?,?,?,?,?,304,304,?,?,?,?
4070,ANCIENT BOWLIES IN UDHAMPUR AT REHMATIMOHALLA BOWLI,JAMMU AND KASHMIR,15,15,7.95,7.95,480,480,BDL,BDL,?,?,?,?,?,?,282,282,?,?,?,?
4072,BOREWELL IN SMAILPUR NEARCHRISTIAN HOSPITAL,JAMMU AND KASHMIR,23,23,7.62,7.62,356,356,?,?,?,?,?,?,?,?,210,210,?,?,?,?
4073,"BOREWELL NEAR MAIN CHOWK,SMAILPUR",JAMMU AND KASHMIR,24,24,7.74,7.74,396,396,?,?,?,?,?,?,?,?,234,234,?,?,?,?
4492,"HAND PUMP NEAR GARBAGEDUMP, RAKSHIBANDH DUMKA",JHARKHAND,23,33,7.5,7.6,202,238,1.1,1.2,?,?,?,?,?,?,200,230,?,?,?,?
4493,HOLY POND AT VILLAGE SIKATIA,JHARKHAND,22,32,7.5,7.6,235,280,1.2,1.6,?,?,?,?,?,?,230,276,?,?,?,?
4758,"GOVT. HANDPUMP NEAR HOUSE OF RAJENDRA SINGH MUNDA,KOKRANA MURI",JHARKHAND,18,26,6.6,6.8,?,?,1.3,6.6,?,?,?,?,?,?,382,386,?,?,?,?
3564,BOREWELL WATER NEAR MANGALIJYOTHI SCHOOL MSWSITE VAMMANJOOR,KARNATAKA,27,28,7.1,7.3,174,184,3,3,2.74,3.77,11,94,140,920,120,124,BDL,BDL,?,?
19,"WELL AT ELOOR,ERNAKULAM",KERALA,26,27,5.7,5.8,100,140,1.6,1.6,1.02,1.53,170,410,240,630,69,80,BDL,BDL,0.001,0.001
22,"WELL AT CHUNGAPALLY, KERALA",KERALA,26,29,5.9,6.6,103,142,BDL,BDL,1.21,1.21,6,40,40,120,62,85,BDL,BDL,?,?
35,"WELL AT PUNALUR, KERALA",KERALA,23,25,6.4,8,157,260,1.1,1.1,2.08,2.08,31,31,100,100,90,167,BDL,BDL,BDL,BDL
1581,"WELL AT PAPPANAMKODE, THIRUVANANTHAPURAM,KERALA",KERALA,27,27,5.2,5.2,158,210,1.8,1.8,?,?,100,200,310,400,93,120,BDL,BDL,0.004,0.004
1582,"WELL AT NEDUMANGAD, THIRUVANANTHAPURAM,KERALA",KERALA,27,27,5.9,6.1,210,270,2.2,2.2,?,?,310,600,600,1000,126,155,BDL,BDL,BDL,BDL
1583,"WELL AT KUNDARA, KOLLAMDISTT. , KERALA",KERALA,22,27,6.5,7.1,153,314,1.1,1.8,16.2,16.2,BDL,BDL,70,110,84,203,BDL,BDL,BDL,BDL
1584,"WELL AT CHERTHALA, ALLEPPY,KERALA",KERALA,30,30,7.2,7.4,209,268,1.4,1.8,?,?,200,200,400,490,141,178,0.8,0.8,BDL,BDL
1585,"WELL AT VYTTILA, ERNAKULAMDISTT. KERALA",KERALA,28,29,7.3,7.4,450,540,1.3,1.5,5.96,5.96,2400,3800,3300,7000,260,320,BDL,BDL,0.004,0.004
1586,"WELL AT EDAYAR ERNAKULAMDISTT., KERALA",KERALA,27,28,6.1,6.2,265,340,1.1,1.4,0.59,3.07,580,1000,790,4000,168,213,BDL,BDL,0.004,0.004
1587,"WELL AT KALAMASSERYERNAKULAM DISTT. ,KERALA",KERALA,27,27,5.9,5.9,245,300,1.2,1.2,1.38,7.24,14,27,63,70,136,168,BDL,BDL,?,?
1588,"WELL AT PUNKUNNAM TRISSURDISTT. , KERALA",KERALA,23,32,7.2,7.4,151,250,1.3,1.9,9.35,9.35,250,250,490,490,90,170,0.78,0.78,BDL,BDL
1589,"WELL AT MALAPURAM , KERALA",KERALA,21,23,7.1,7.5,326,353,BDL,BDL,1.3,3.5,34,43,63,120,195,208,BDL,BDL,0.003,0.003
1590,"WELL AT MAVOOR, KOZHIKKODEDISTT. , KERALA",KERALA,26,30,6.3,6.9,79,81,BDL,BDL,?,?,100,430,140,810,46,48,BDL,BDL,?,?
1591,WELL AT KANNUR MUNICIPALITYKANNUR,KERALA,28,28,4.4,5.5,100,116,1.8,1.8,?,?,110,150,200,400,66,68,BDL,BDL,BDL,BDL
1592,"WELL AT PAYYANNUR, KANNURDISTT. , KERALA",KERALA,27,29,6.6,6.7,112,262,1.4,1.4,?,?,40,490,200,910,60,180,BDL,BDL,BDL,BDL
2308,WELL AT FATHIMAPURAM(CHANGANASSERY),KERALA,27,28,6.3,6.8,151,168,1.9,1.9,1.46,1.46,150,150,400,400,102,105,BDL,BDL,0.012,0.012
2309,WELL AT KAROOR (PALA),KERALA,25,26,?,5.7,81,153,1.1,1.2,0.67,0.67,BDL,BDL,100,250,58,92,1.1,1.1,?,?
2310,WELL AT VAIKOM,KERALA,25,26,5.2,5.7,156,249,1.4,1.4,?,?,BDL,BDL,200,200,100,172,BDL,BDL,?,?
2311,WELL AT VADAVATHOOR(KOTTAYAM),KERALA,26,27,4.9,6.2,77,103,BDL,BDL,1.47,1.84,250,250,610,910,60,72,BDL,BDL,0.001,0.001
2313,"WELL AT SARVODAPURAM,ALAPPUZHA",KERALA,30,30,7.2,7.4,156,234,1.9,2,?,?,700,700,1800,1800,108,132,0.8,0.8,BDL,BDL
2314,WELL AT KUREEPUZHA (KOLLAM),KERALA,23,27,6.5,7.1,163,323,1.2,1.4,36.24,36.24,40,40,10,140,98,211,BDL,BDL,BDL,BDL
2315,WELL AT K.M.M.L. (KOLLAM),KERALA,23,24,7.2,8.3,221,438,1.4,1.9,3.81,3.81,31,40,81,120,140,286,BDL,BDL,BDL,BDL
2316,WELL AT CHELLORA TRENCHINGGROUND (KANNUR),KERALA,27,27,4.7,6.2,133,146,BDL,BDL,?,?,79,600,310,790,65,102,BDL,BDL,BDL,BDL
2317,WELL AT PUNNALPETTIPPALAM,KERALA,26,28,6.5,6.8,145,330,BDL,BDL,?,?,40,100,100,350,95,231,BDL,BDL,0.004,0.004
2320,WELL AT MANJERI,KERALA,21,23,7,7.2,252,254,BDL,BDL,0.7,2.7,32,32,81,150,140,142,BDL,BDL,0.001,0.001
2321,WELL AT LALOOR (THRISSUR),KERALA,24,30,7.1,7.8,83,245,1.4,2.1,5.38,5.38,BDL,BDL,BDL,BDL,53,155,0.67,0.67,BDL,BDL
2322,WELL AT OLLUR (THRISSUR),KERALA,28,29,6.1,7.3,93,172,1.1,1.6,6.38,6.38,BDL,BDL,BDL,BDL,57,120,0.38,0.73,BDL,BDL
2323,WELL AT BRAHMAPURAMM.S.W. DUMPARK,KERALA,27,28,6,6.5,150,204,1.2,1.7,0.57,0.57,94,400,630,1300,83,121,BDL,BDL,BDL,BDL
2324,WELL AT HAZARDOUS WASTE DUMP (AMBALAMUGALBOREWELL),KERALA,27,28,5,5.7,100,110,BDL,BDL,1.02,4.98,200,790,790,1200,64,66,BDL,BDL,0.002,0.002
2327,WELL AT KARUKAMANI,KERALA,27,28,6.9,8.4,855,885,1.7,1.7,0.5,0.5,400,400,300,900,548,559,0.48,0.48,0.008,0.008
3463,"WELL AT VELLIPARAMBA,KOZHEKODE",KERALA,26,30,5.5,6.9,81,116,BDL,BDL,?,?,40,400,81,630,50,68,BDL,BDL,?,?
3472,"WELL OF TEMPLEPARASSINIKADAVU, KANNUR",KERALA,28,29,5.3,7.3,215,435,1.6,1.6,?,?,79,600,350,910,120,305,BDL,BDL,BDL,BDL
3474,"WELL AT PAYANOOR, KANNUR",KERALA,27,29,6.5,7.6,111,118,1.9,3,?,?,70,600,310,910,70,70,BDL,BDL,BDL,BDL
3475,"WELL AT KARIMBAM, KANNUR",KERALA,27,28,4.3,6.1,55,130,1.6,2.2,?,?,80,310,300,490,39,73,BDL,BDL,0.003,0.003
5219,"WELL AT SRI KIRATHAMOORTHY SIVA TEMPLE, KANJIKKODE,PALAKKAD",KERALA,26,27,6.5,7.7,92,147,BDL,BDL,1.1,1.1,600,600,1400,1400,58,86,0.33,0.33,BDL,BDL
1402,WELL C/O KULAKKINAPURA,LAKSHADWEEP,28.7,28.7,7.13,7.13,810,810,?,?,?,?,37,37,240,240,543,543,?,?,?,?
1593,WELL NEAR JB SCHOOL (E),LAKSHADWEEP,28.3,28.3,7.47,7.47,920,920,?,?,?,?,BDL,BDL,8,8,616,616,?,?,?,?
1594,WELL NEAR OTTAVATHIL PALLI,LAKSHADWEEP,28.5,28.5,7.21,7.21,960,960,?,?,?,?,34,34,240,240,643,643,?,?,?,?
1595,WELL C/O CHEKKILLAM HOUSE,LAKSHADWEEP,29.3,29.3,7.35,7.35,730,730,?,?,?,?,22,22,70,70,620,620,?,?,?,?
1596,WELL C/O KADATH PALLI,LAKSHADWEEP,28.2,28.2,7.31,7.31,630,630,?,?,?,?,BDL,BDL,1600,1600,422,422,?,?,?,?
1597,WELL C/O BADAR PALLI,LAKSHADWEEP,26.4,26.4,7.47,7.47,690,690,?,?,?,?,23,23,130,130,462,462,?,?,?,?
1598,WELL C/O PUTHIYA PALLI,LAKSHADWEEP,29.9,29.9,7.48,7.48,640,640,?,?,?,?,13,13,23,23,355,355,?,?,?,?
1599,WELL C/O PURATHA PALLI,LAKSHADWEEP,28.5,28.5,7.29,7.29,620,620,?,?,?,?,17,17,22,22,570,570,?,?,?,?
1600,WELL C/O ANDAM PALLI,LAKSHADWEEP,29.5,29.5,7,7,730,730,?,?,?,?,BDL,BDL,43,43,480,480,?,?,?,?
1601,WELL C/O CIRCUIT HOUSE,LAKSHADWEEP,28.2,28.2,7.46,7.46,660,660,?,?,?,?,BDL,BDL,33,33,570,570,?,?,?,?
1602,WELL C/O GOVT. PRESS,LAKSHADWEEP,27.3,27.3,7.47,7.47,720,720,?,?,?,?,130,130,240,240,482,482,?,?,?,?
1603,WELL C/O POLICE QUARTERS,LAKSHADWEEP,29.5,29.5,7.18,7.18,1750,1750,?,?,?,?,13,13,13,13,400,400,?,?,?,?
1604,WELL BACK SIDE OF TEMPLE,LAKSHADWEEP,29,29,7.28,7.28,1530,1530,?,?,?,?,4,4,22,22,1010,1010,?,?,?,?
1605,WELL AT CHICKEN NECK,LAKSHADWEEP,29.4,29.4,7.44,7.44,1709,1709,?,?,?,?,170,170,170,170,1245,1245,?,?,?,?
1606,WELL NEAR POWER HOUSEQUARTERS,LAKSHADWEEP,27.6,27.6,7.18,7.18,1200,1200,?,?,?,?,70,70,110,110,970,970,?,?,?,?
4548,WELL C/O POULTRY FARM,LAKSHADWEEP,29.1,29.1,7.41,7.41,540,540,?,?,?,?,7,7,17,17,350,350,?,?,?,?
4549,WELL NEAR NARANGA PURA,LAKSHADWEEP,29,29,7.31,7.31,1720,1720,?,?,?,?,19,19,280,280,1152,1152,?,?,?,?
4550,WELL NEAR SLAUTER HOUSE,LAKSHADWEEP,28.2,28.2,7.36,7.36,810,810,?,?,?,?,24,24,1600,1600,543,543,?,?,?,?
4551,WELL NEAR LTTD PLANT,LAKSHADWEEP,24.2,24.2,7.23,7.23,1130,1130,?,?,?,?,22,22,130,130,757,757,?,?,?,?
4552,WELL C/O HIGH SCHOOL,LAKSHADWEEP,28.2,28.2,7.46,7.46,930,930,?,?,?,?,7,7,26,26,530,530,?,?,?,?
4553,WELL NEAR JBS (N),LAKSHADWEEP,29.6,29.6,7.24,7.24,1320,1320,?,?,?,?,4,4,1600,1600,1250,1250,?,?,?,?
4554,WELL C/O IG HOSPITAL,LAKSHADWEEP,29.2,29.2,7.09,7.09,780,780,?,?,?,?,9,9,12,12,710,710,?,?,?,?
4555,WELL NEAR WASTE DUMPINGSITE,LAKSHADWEEP,28.5,28.5,7.35,7.35,1620,1620,?,?,?,?,11,11,21,21,990,990,?,?,?,?
4556,WELL C/O SOLAR POWER PLANT,LAKSHADWEEP,28.6,28.6,7.44,7.44,840,840,?,?,?,?,7,7,22,22,460,460,?,?,?,?
4558,WELL C/O BARALI SURAMBI,LAKSHADWEEP,30.4,31.7,7.1,7.3,1100,1228,?,?,?,?,?,?,?,?,715,798,?,?,?,?
4559,WELL C/O THAJ MANZIL,LAKSHADWEEP,30.4,31.9,7.1,7.2,1330,2100,?,?,?,?,?,?,?,?,865,1365,?,?,?,?
4560,WELL C/O POOVALAP,LAKSHADWEEP,30,30.6,6.9,7,1011,1214,?,?,?,?,?,?,?,?,657,789,?,?,?,?
4561,WELL C/O PUTHIYA PAKKIMADA,LAKSHADWEEP,30.1,30.8,7,7.3,1029,1271,?,?,?,?,?,?,?,?,669,826,?,?,?,?
4562,WELL C/O BELIYACHADA,LAKSHADWEEP,32.6,32.8,7.3,7.4,1820,3600,?,?,?,?,?,?,?,?,1183,2340,?,?,?,?
4563,WELL C/O KANCHARAKAKADA,LAKSHADWEEP,30.6,31.1,6.8,6.9,1136,1860,?,?,?,?,?,?,?,?,738,1209,?,?,?,?
4564,WELL C/O KUNJACHA,LAKSHADWEEP,32.1,32.3,6.8,6.8,954,964,?,?,?,?,?,?,?,?,620,627,?,?,?,?
4565,WELL C/O LAGOONS BATH,LAKSHADWEEP,32.1,32.9,7,7,989,1001,?,?,?,?,?,?,?,?,643,651,?,?,?,?
4566,WELL NEAR S&T,LAKSHADWEEP,32.4,32.9,7.1,7.1,1002,1201,?,?,?,?,?,?,?,?,651,781,?,?,?,?
4567,WELL C/O UJRA PALLI,LAKSHADWEEP,30.1,31.1,7,7.1,125,559,?,?,?,?,?,?,?,?,363,363,?,?,?,?
4569,WELL C/O DARUL NOOR,LAKSHADWEEP,32.4,32.5,7,7.1,862,1203,?,?,?,?,?,?,?,?,560,781,?,?,?,?
4570,WELL C/O CHC SUB CENTRENORTH,LAKSHADWEEP,30.2,31.7,7.2,7.4,2310,2630,?,?,?,?,?,?,?,?,1502,1710,?,?,?,?
4571,WELL C/O MAMPURAM,LAKSHADWEEP,32.4,34.8,7.1,7.1,1320,1700,?,?,?,?,?,?,?,?,858,1105,?,?,?,?
4572,WELL C/O OBSERVATORY,LAKSHADWEEP,32.5,32.7,7.3,7.5,702,712,?,?,?,?,?,?,?,?,456,463,?,?,?,?
4573,WELL C/O BALIYOMME CHETTA,LAKSHADWEEP,32.7,32.8,6.9,7.1,2280,2750,?,?,?,?,?,?,?,?,1483,1788,?,?,?,?
4574,WELL C/O MOULA PALLI,LAKSHADWEEP,30.2,30.9,7.1,7.2,690,724,?,?,?,?,?,?,?,?,449,471,?,?,?,?
4575,WELL C/O BEEREDAM,LAKSHADWEEP,30.1,30.3,7.1,7.4,958,1001,?,?,?,?,?,?,?,?,623,651,?,?,?,?
4576,WELL C/O HUSSAIN MANZIL,LAKSHADWEEP,32.1,32.4,7.1,7.3,657,662,?,?,?,?,?,?,?,?,427,430,?,?,?,?
52,"WELL, SHRI RAO PRAJAPATI WELL, M. P. (T/W OF HANIF KHAN S/O JABBAR KHAN, AMRAWATIROAD, BURHANPUR )",MADHYA PRADESH,20,21.5,7.84,8.3,891,1320,BDL,BDL,2.1,2.59,BDL,BDL,3.6,3.7,564,730,0.64,0.76,?,?
1616,"TUBE WELL WATER ? INDUSTRIAL AREA, GOVINDPURA, BHOPAL,(M.P)",MADHYA PRADESH,26,27,7.49,7.69,867,1428,1.5,1.6,21.19,24.15,3.7,13,27,350,618,968,BDL,BDL,BDL,BDL
1617,"OPEN WELL/TUBE WELL INDUSTRIAL AREA MANDIDEEP,DISTT.RAISEN, M.P",MADHYA PRADESH,25,27,7.21,8.12,920,1200,1.5,2,11.42,13.42,26,38,220,430,535,790,BDL,BDL,BDL,BDL
1618,"HAND PUMP, MALANPUR HARIRAM KA PURA (EAST)",MADHYA PRADESH,18,22,7.2,7.72,435,936,?,?,0.48,1.3,?,?,?,?,282,585,?,?,?,?
1619,"HAND PUMP, JHIRONGI,MALANPUR BHIND (WEST)",MADHYA PRADESH,27.5,29,7.68,7.8,655,864,?,?,1.3,2.75,3,3,12,12,440,540,?,?,?,?
1897,"TUBE WELL AT JAINABAD, NEAR TAPTI RIVER BRIDGE, PUMPINGSTN. BURHANPUR, M.P.",MADHYA PRADESH,20,21,5,7.84,808,1320,BDL,BDL,2.06,2.83,BDL,BDL,3.7,3.7,490,730,0.52,0.76,?,?
2143,"HAND PUMP WATER ATKATHONDA, JABALPUR",MADHYA PRADESH,22.7,22.7,7.23,7.26,278,809,BDL,BDL,2.3,2.3,2,2,10,10,92,262,?,?,BDL,BDL
2144,"HAND PUMP WATER AT MADAIGRAM, JABALPUR",MADHYA PRADESH,?,?,8.33,8.33,524,524,BDL,BDL,?,?,?,?,?,?,498,498,?,?,BDL,BDL
2145,"WELL AT MEHATWAS, NAGDA",MADHYA PRADESH,27,27,7.29,7.38,1480,1932,1.4,1.4,4.7,5.87,?,?,?,?,1034,1636,?,?,BDL,BDL
2146,"WELL AT BHAGATPURI VILLAGE,NAGDA",MADHYA PRADESH,27,27,7.19,7.55,1242,1626,1.2,1.2,1.82,4.14,?,?,?,?,874,1380,?,?,BDL,BDL
2147,"WELL AT PRATAL NAGAR, DEWAS",MADHYA PRADESH,?,?,7.24,7.24,1716,1716,1.6,1.6,3.98,3.98,?,?,?,?,1188,1188,?,?,BDL,BDL
2148,"WELL AT DOSIGAON, RATLAM",MADHYA PRADESH,29,29,7.41,7.46,1940,2162,1.4,1.8,4.98,9.28,BDL,BDL,12,48,1514,1640,0.26,0.26,BDL,BDL
2149,"WELL AT CULVERT ON A.B. ROAD,MAKSI",MADHYA PRADESH,24,24,7.6,7.72,976,1748,1.4,1.4,4.62,4.88,?,?,?,?,684,1224,?,?,BDL,BDL
2150,"WELL AT TRENCHING GROUND, NEAR GARDEN, DEV GURADIYAROAD, INDORE",MADHYA PRADESH,20,21,7.6,8.05,1516,2779,BDL,BDL,2.21,3.47,BDL,BDL,3.6,3.7,952,1767,0.67,0.72,?,?
2151,"WELL AT TRENCHING GROUND IN THE PREMISES OF M/S RISHABHMASALA UDYOG, INDORE",MADHYA PRADESH,21,21,7.41,7.56,3112,3439,1.2,1.2,4.75,5.27,BDL,BDL,3.7,5.6,1930,2163,0.65,0.89,?,?
2152,"WELL AT TRENCHING GROUND IN THE PREMISES OF M/S LAKHANIFOOT WEAR, INDORE",MADHYA PRADESH,21,21.5,7.5,7.8,1744,4379,1.2,1.2,3.13,4.19,BDL,BDL,3.6,5.6,1140,2727,0.72,0.79,?,?
2153,"TUBWELL WATER AT IBRAHIMGANJ NEAR BUS STAND,BHOPAL (M.P.)",MADHYA PRADESH,25,25,7.05,7.26,504,700,BDL,BDL,5.72,37.78,17,17,26,46,340,418,0.97,0.97,BDL,BDL
2154,"WELL AT NEAR PRIMARYSCHOOL, PILUKHEDI, RAJGARH.",MADHYA PRADESH,28,28,7.1,7.1,810,810,?,?,0.47,0.47,?,?,?,?,520,520,?,?,?,?
3332,"TUBE WELL/ HAND PUMP ATINDUSTRIAL AREA, DEWAS",MADHYA PRADESH,22,30,7.12,7.78,1426,3060,1.2,2,4.34,6.53,?,?,?,?,998,2190,?,?,BDL,BDL
3333,"HAND PUMP WATER ATBANSKHEDI, BHOPAL(M.P.)",MADHYA PRADESH,23,24,7.05,7.08,464,551,BDL,BDL,0.87,3.13,BDL,BDL,21,21,252,358,0.67,0.67,BDL,BDL
3335,"TUBE WELL/ HAND PUMP AT INDUSTRIAL AREA RECHHAI,JABALPUR",MADHYA PRADESH,23,23,7,7.31,527,638,BDL,BDL,2.3,2.3,2,2,10,10,475,503,?,?,BDL,BDL
3337,TUBE WELL/ HAND PUMP AT INDL AREA SEONI NEARBARAPATTHAR,MADHYA PRADESH,22,22,7.25,7.4,240,324,1.8,1.8,0.32,0.39,BDL,BDL,17,17,140,292,BDL,BDL,?,?
3338,"HAND PUMP NEAR PANCHAYAT BHAWAN, VILLAGE TINAWALIRAIRU",MADHYA PRADESH,26,28,7.25,7.25,850,930,?,?,1.1,1.1,?,?,?,?,500,617,?,?,?,?
3339,"TUBE WELL/ HAND PUMP NEAR MANGLIA INDUSTRIAL AREA ,INDORE",MADHYA PRADESH,21,21,7.4,7.64,1188,1400,BDL,BDL,2.03,3.46,BDL,BDL,3.6,3.7,742,803,0.69,0.74,?,?
3340,"TUBE WELL AT NEAR TRENCHINGGROUND, INDORE",MADHYA PRADESH,20,21,7.59,7.7,1182,2605,BDL,BDL,2.8,3.12,BDL,BDL,3.6,5.5,1110,1663,0.66,0.77,?,?
3341,"TUBE WELL AT SECTOR?III,PITHAMPUR INDUSTRIAL AREA",MADHYA PRADESH,20.5,22,7.33,7.99,1147,8888,BDL,BDL,2.1,3.15,BDL,BDL,3.6,3.6,533,789,0.72,0.82,?,?
3342,"BOREWELL WATER AT VILLAGE TARPUR, SECTOR?II,PITHAMPUR,INDUSTRIAL AREA",MADHYA PRADESH,20,22,7.33,7.6,663,682,BDL,BDL,2.94,3.85,BDL,BDL,3.5,3.6,399,494,0.72,0.78,?,?
3344,"TUBEWELL AT INDL AREA, SHAHDOLU/G WATER SAMPLE FROM INDUSTRIAL AREA,NARSARHA,DISTT.SHAHDOL(M.P.)",MADHYA PRADESH,28.2,30,7.35,7.72,663,712,BDL,BDL,0.86,1.64,BDL,BDL,BDL,BDL,519,581,?,?,?,?
3345,"TUBEWELL AT INDL AREA,ANUPPUR",MADHYA PRADESH,27.8,29.8,6.87,7.12,798,6875,BDL,BDL,1.44,1.84,BDL,BDL,BDL,BDL,570,653,?,?,?,?
3822,"GROUND WATER NEAR BUSSTAND, DIST NARSINGPUR",MADHYA PRADESH,23,23,7.4,7.4,210,230,1.8,1.8,?,?,?,?,?,?,150,170,?,?,BDL,BDL
3823,"GROUND WATER NEAR BUSSTAND, DIST BALAGHAT",MADHYA PRADESH,22,22,7.38,7.5,200,612,BDL,BDL,?,?,?,?,?,?,100,580,?,?,BDL,BDL
3824,"GROUND WATER VILL BHEEMJORI, MALAJKH, DISTBALAGHAT",MADHYA PRADESH,22,22,7.5,7.5,?,?,1.4,1.4,?,?,BDL,BDL,9,9,130,130,?,?,?,?
3825,"GROUND WATER NEAR BUSSTAND, DIST MANDLA",MADHYA PRADESH,?,?,7.21,7.5,190,312,BDL,BDL,?,?,?,?,?,?,130,280,?,?,?,?
3826,"GROUND WATER NEAR BUSSTAND, DIST SEONI",MADHYA PRADESH,?,?,7.18,7.5,190,366,BDL,BDL,?,?,?,?,?,?,130,354,?,?,BDL,BDL
3827,"GROUND WATER VILL IMALIA,DIST JABALPUR",MADHYA PRADESH,23.2,23.2,7.36,7.85,428,428,BDL,BDL,?,?,?,?,?,?,292,478,BDL,BDL,BDL,BDL
3837,"GROUND WATER PRIMARY SCHOOL DHOBI GHAT, DISTSINGROULI",MADHYA PRADESH,?,?,7.37,7.37,1036,1036,?,?,3.96,3.96,?,?,?,?,598,598,?,?,?,?
3838,"GROUND WATER NCL, JINGURDHA, QSHF?176 METENCE OFF, DISTSINGROULI",MADHYA PRADESH,?,?,7.71,7.71,1213,1213,?,?,4.02,4.02,?,?,?,?,926,926,?,?,?,?
3839,"GROUND WATER NEAR SHIV MANDIR, AMLORI NCL, PROJECTSINGROULI",MADHYA PRADESH,?,?,6.88,6.88,1026,1026,?,?,3.94,3.94,?,?,?,?,779,779,?,?,?,?
3840,"GROUND WATER NEAR SUBJEE MANDI NCL JAYANT (BESIDE POLICESTATION), SINGROULI",MADHYA PRADESH,24,24,7.26,7.26,1035,1035,?,?,3.03,3.03,?,?,?,?,589,589,?,?,?,?
3841,"GROUND WATER SARVESWAR RAJA COLONY JAYANT,SINGROULI",MADHYA PRADESH,25,25,7.3,7.3,1056,1056,?,?,0.38,0.38,?,?,?,?,771,771,?,?,?,?
3842,"GROUND WATER NEAR SUB STATION SECTOR?B, DUDHICHUA NCLPROJECT, SINGROULI",MADHYA PRADESH,23,23,7.6,7.6,723,723,?,?,3.82,3.82,?,?,?,?,375,375,?,?,?,?
3843,"GROUND WATER NEAR ENTRANCE GAGE OF VIVEKANANADSTATUE, NIGAHI, SINGROULI",MADHYA PRADESH,28,28,7.87,7.87,958,958,?,?,4.43,4.43,?,?,?,?,586,586,?,?,?,?
3844,"GROUND WATER NEAR COMMERCIAL AUTO MOBILE NEARBHARAT PETROL PUMP, VINDHYANAGAR, SINGROULI",MADHYA PRADESH,27,27,7.49,7.49,670,670,?,?,4.76,4.76,?,?,?,?,499,499,?,?,?,?
4618,"GROUND WATER AT INDUSTRIALAREA, MANERI DISTT MANDLA",MADHYA PRADESH,?,?,7.23,7.23,496,508,BDL,BDL,?,?,?,?,?,?,413,428,?,?,BDL,BDL
4625,"HAND PUMP WATER AT DISTRICTHOSPITAL, BHOPAL (M.P.)",MADHYA PRADESH,22,24,7.18,7.21,673,688,BDL,BDL,6.59,8.07,4,4,33,33,430,488,BDL,BDL,BDL,BDL
4626,"HAND PUMP  WATER AT DISTRICT HOSPITAL ,SEHORE (M.P.)",MADHYA PRADESH,25,27,6.93,6.97,686,1212,BDL,BDL,10.42,46.48,3.6,6.1,210,210,504,790,BDL,BDL,BDL,BDL
4627,HAND PUMP DISTRICT HOSPITALHOSHANGABAD,MADHYA PRADESH,27,27,7.23,7.23,688,688,1.1,1.1,7.2,7.2,11,11,350,350,438,438,BDL,BDL,BDL,BDL
4628,"HAND PUMP WATER AT DISTRICTHOSPITAL ,VIDISHA( M.P.)",MADHYA PRADESH,25,30,6.96,7.57,685,816,1.4,2.7,1.14,10.77,BDL,BDL,34,94,464,556,BDL,BDL,BDL,BDL
4629,HAND PUMP DSTRICT HOSPITALRAISEN,MADHYA PRADESH,26,29,7.62,7.63,871,878,2.2,3,9.51,13.42,BDL,BDL,9.2,17,600,639,BDL,BDL,BDL,BDL
1985,"DUG WELL AT 5 ?STAR INDUSTRIAL ESTATE, VILLAGE? KASHIMIRA , TALUKA? THANE,DISTRICT?THANE.",MAHARASHTRA,26,29,6.9,7.5,882,1775,6,50,?,?,7.8,22,49,49,788,1612,1.4,1.4,BDL,BDL
1987,"BORE WELL AT VASAI,  VILLAGE? GOKHIWARE, TALUKA? VASAI,DISTRICT? PALGHAR.",MAHARASHTRA,26,27,7,7.4,629,1333,4.2,5,1.15,1.15,6.8,13,46,70,608,1208,0.24,0.79,BDL,BDL
1989,"BORE WELL AT MWML SITE AT TALOJA, VILLAGE?KARAWLA? TALOJA,TALUKA? PANVEL,DISTRICT? RAIGAD.",MAHARASHTRA,27,29,7.1,7.1,1763,2205,5,5,0.33,0.59,17,23,70,140,1914,1914,BDL,BDL,BDL,BDL
1990,"BORE WELL AT BMW SITE, VILLAGE?BURUDGAON ,TALUKA? AHMEDNAGAR,DISTRICT?AHMEDNAGAR.",MAHARASHTRA,20,24,7.2,7.3,2355,3458,3.4,3.6,0.34,5.64,4,6,40,63,1810,2789,BDL,BDL,?,?
1991,"BORE WELL AT MSW SITE,VILLAGE?PATHARDI,TALUKA? NASHIK,DISTRICT?NASHIK.",MAHARASHTRA,26,27,7.5,7.6,582,1700,3.5,6.2,0.34,1.75,6,11,58,79,461,1321,BDL,BDL,BDL,BDL
1992,"DUG WELL AT MSW SITE, OWNED BY SHRI. DATTU KONDIBA BORATE AT BORATE VASTHI, VILLAGE? MOSHI, PIMPRI CHINCHWAD, TALUKA? HAWELI,DISTRICT? PUNE.",MAHARASHTRA,26,29,7.2,7.6,659,706,4.4,6.2,2.51,5.81,6,9,95,250,540,612,0.58,0.58,?,?
1993,"DUG WELL AT PANDHARPUR, VILLAGE?PANDHARPUR, TALUKA? GANGAPUR, DISTRICT ?AURANGABAD.",MAHARASHTRA,28,40,7.3,7.7,1247,1619,2.4,5.8,13,19.7,2,2,6.8,23,1052,1220,0.51,1.02,?,?
1994,"DUG WELL AT TPS?DURGAPUR, NEAR NASEEB KIRANA AND GENERAL STORES, VILLAGE? DURGAPUR, TALUKA? CHANDRAPUR, DISTRICT?CHANDRAPUR.",MAHARASHTRA,19,19,7.2,7.5,912,996,3.2,3.8,?,?,17,32,140,170,719,880,BDL,BDL,BDL,BDL
1995,"GRAM PANCHAYATH DUG WELL , NEAR BALAJI GAJBHIYE HOUSE,VILLAGE?KHAPERKHEDA ( WARD NO.4) , TALUKA? SAONER,DISTRICT? NAGPUR.",MAHARASHTRA,25,35,7.8,8.3,1164,1229,3.2,3.4,?,?,10,26,94,170,969,1002,0.42,0.42,BDL,BDL
1996,"GRAM PANCHAYATH DUG WELL , NEAR JAGADAMBA G. M. S. MANDIR SAHAKARI SANSTHA, VILLAGE?KORADI,TALUKA?KAMPTEE, DISTRICT? NAGPUR.",MAHARASHTRA,25,35,7.5,8.2,1404,1544,3,3.6,?,?,21,24,120,120,1269,1312,BDL,BDL,BDL,BDL
